{"$id":"https://autocut.invalid/contracts/2.1.3/stage_05/contributions/stage-05-owner-contribution.manifest.schema.json","$schema":"https://json-schema.org/draft/2020-12/schema","additionalProperties":false,"properties":{"authority_commit":{"const":"77f6db99019eb3e24e7b20ac92a2463a3bb3156c"},"b_input":{"additionalProperties":false,"properties":{"handoff_git_commit":{"const":"50f78ea0b7f754eb8f91ef800924b86da25b3083"},"handoff_raw_sha256":{"const":"sha256:07fd0e9d4dbe03050f9aa3f4823755e4ba1e7f4852a163ab2fa291c0b3710eb6"},"producer_git_commit":{"const":"eb7e4181f63da308c405bad6d99fcd085cfdd98a"},"selected_ids":{"const":["B0-001","B0-002","B0-005","B0-006","B0-007","B0-008","B0-009","B0-010","B0-011"]},"used_primitive_blobs":{"const":[{"path":"schemas/primitives/artifact-ref.schema.json","raw_sha256":"sha256:9df321d5ccc33dd8ff307aae6f33d1e4d2accfc278ea4fb5ed11072e5e5295db"}]}},"required":["handoff_git_commit","handoff_raw_sha256","producer_git_commit","selected_ids","used_primitive_blobs"],"type":"object"},"closed_self_exclusion_protocol":{"const":{"external_attestation_bound_files":[{"path":"contributions/stage-05-owner-contribution.manifest.json"},{"path":"contributions/stage-05-owner-contribution.manifest.schema.json"}],"producer_file_count_breakdown":{"external_attestation_bound_files":2,"hashed_source_files":12,"total_files":14}}},"contract_version":{"const":"2.1.3"},"deferred_bindings":{"const":["B0-012 remains unresolved.","B0-028/AC-B-008 remains unresolved.","AC-B-005 remains unresolved.","AC-B-007 remains unresolved.","AC-B-001/002/009 remains unresolved.","F/G/H ownership remains unresolved.","Renderer/QC evaluator/publication-policy/transaction-coordinator/platform-capability/dual-runtime-conformance bindings remain unresolved."]},"format":{"const":"autocut.stage-05-owner-contribution/v1"},"producer_base_commit":{"const":"50f78ea0b7f754eb8f91ef800924b86da25b3083"},"producer_file_count":{"const":14},"producer_files":{"additionalItems":false,"items":false,"minItems":12,"prefixItems":[{"additionalProperties":false,"properties":{"path":{"const":"fixtures/stage-05-structural-valid.json"},"raw_sha256":{"pattern":"^sha256:[0-9a-f]{64}$","type":"string"}},"required":["path","raw_sha256"],"type":"object"},{"additionalProperties":false,"properties":{"path":{"const":"obligations/stage-05-source-anchor-worklist.json"},"raw_sha256":{"pattern":"^sha256:[0-9a-f]{64}$","type":"string"}},"required":["path","raw_sha256"],"type":"object"},{"additionalProperties":false,"properties":{"path":{"const":"obligations/stage-05-vector-anchor-worklist.json"},"raw_sha256":{"pattern":"^sha256:[0-9a-f]{64}$","type":"string"}},"required":["path","raw_sha256"],"type":"object"},{"additionalProperties":false,"properties":{"path":{"const":"shapes/publication-evidence-wire.local-shape.json"},"raw_sha256":{"pattern":"^sha256:[0-9a-f]{64}$","type":"string"}},"required":["path","raw_sha256"],"type":"object"},{"additionalProperties":false,"properties":{"path":{"const":"shapes/publication-target-surface-wire.local-shape.json"},"raw_sha256":{"pattern":"^sha256:[0-9a-f]{64}$","type":"string"}},"required":["path","raw_sha256"],"type":"object"},{"additionalProperties":false,"properties":{"path":{"const":"shapes/qc-metric-profile.local-shape.json"},"raw_sha256":{"pattern":"^sha256:[0-9a-f]{64}$","type":"string"}},"required":["path","raw_sha256"],"type":"object"},{"additionalProperties":false,"properties":{"path":{"const":"shapes/qc-observation-wire.local-shape.json"},"raw_sha256":{"pattern":"^sha256:[0-9a-f]{64}$","type":"string"}},"required":["path","raw_sha256"],"type":"object"},{"additionalProperties":false,"properties":{"path":{"const":"shapes/release-lineage-wire.local-shape.json"},"raw_sha256":{"pattern":"^sha256:[0-9a-f]{64}$","type":"string"}},"required":["path","raw_sha256"],"type":"object"},{"additionalProperties":false,"properties":{"path":{"const":"shapes/render-attempt-observation.local-shape.json"},"raw_sha256":{"pattern":"^sha256:[0-9a-f]{64}$","type":"string"}},"required":["path","raw_sha256"],"type":"object"},{"additionalProperties":false,"properties":{"path":{"const":"shapes/render-input-wire.local-shape.json"},"raw_sha256":{"pattern":"^sha256:[0-9a-f]{64}$","type":"string"}},"required":["path","raw_sha256"],"type":"object"},{"additionalProperties":false,"properties":{"path":{"const":"shapes/rendered-asset-wire.local-shape.json"},"raw_sha256":{"pattern":"^sha256:[0-9a-f]{64}$","type":"string"}},"required":["path","raw_sha256"],"type":"object"},{"additionalProperties":false,"properties":{"path":{"const":"tests/test-stage-05-owner-source.json"},"raw_sha256":{"pattern":"^sha256:[0-9a-f]{64}$","type":"string"}},"required":["path","raw_sha256"],"type":"object"}],"type":"array"},"producer_manifest_path":{"const":"contributions/stage-05-owner-contribution.manifest.json"}},"required":["authority_commit","b_input","closed_self_exclusion_protocol","contract_version","deferred_bindings","format","producer_base_commit","producer_file_count","producer_files","producer_manifest_path"],"type":"object"}