{"authority_commit":"77f6db99019eb3e24e7b20ac92a2463a3bb3156c","b_input":{"handoff_git_commit":"50f78ea0b7f754eb8f91ef800924b86da25b3083","handoff_raw_sha256":"sha256:07fd0e9d4dbe03050f9aa3f4823755e4ba1e7f4852a163ab2fa291c0b3710eb6","producer_git_commit":"eb7e4181f63da308c405bad6d99fcd085cfdd98a","selected_ids":["B0-001","B0-002","B0-005","B0-006","B0-007","B0-008","B0-009","B0-010","B0-011"],"used_primitive_blobs":[{"path":"schemas/primitives/artifact-ref.schema.json","raw_sha256":"sha256:9df321d5ccc33dd8ff307aae6f33d1e4d2accfc278ea4fb5ed11072e5e5295db"}]},"closed_self_exclusion_protocol":{"external_attestation_bound_files":[{"path":"contributions/stage-05-owner-contribution.manifest.json"},{"path":"contributions/stage-05-owner-contribution.manifest.schema.json"}],"producer_file_count_breakdown":{"external_attestation_bound_files":2,"hashed_source_files":12,"total_files":14}},"contract_version":"2.1.3","deferred_bindings":["B0-012 remains unresolved.","B0-028/AC-B-008 remains unresolved.","AC-B-005 remains unresolved.","AC-B-007 remains unresolved.","AC-B-001/002/009 remains unresolved.","F/G/H ownership remains unresolved.","Renderer/QC evaluator/publication-policy/transaction-coordinator/platform-capability/dual-runtime-conformance bindings remain unresolved."],"format":"autocut.stage-05-owner-contribution/v1","producer_base_commit":"50f78ea0b7f754eb8f91ef800924b86da25b3083","producer_file_count":14,"producer_files":[{"path":"fixtures/stage-05-structural-valid.json","raw_sha256":"sha256:ca0372d6067c3db8691b841ff71603a190fdaa58cc641a663ddf3f15b8b67eb1"},{"path":"obligations/stage-05-source-anchor-worklist.json","raw_sha256":"sha256:1e45f6dfab4c0d417e983d8aeeda644652ca7e4520aa9bde0801a3cc4bb5ece3"},{"path":"obligations/stage-05-vector-anchor-worklist.json","raw_sha256":"sha256:ac367f0463f8a00dc4e02b1d1bd4f09724e87b933b9f20ed5140a96c377ce7ed"},{"path":"shapes/publication-evidence-wire.local-shape.json","raw_sha256":"sha256:7a0b004c2fd16bd54d9ddaf1dbcb43062496457e52b5abc664c9f6344ecf00e3"},{"path":"shapes/publication-target-surface-wire.local-shape.json","raw_sha256":"sha256:e0a384a73d2808d79455afb292d5166c1a30bb54a050af47aef3ac1f554ac4aa"},{"path":"shapes/qc-metric-profile.local-shape.json","raw_sha256":"sha256:71ba3715dd82157b981451757b735b4919f6dfea89c506179b36ad679ea9c99a"},{"path":"shapes/qc-observation-wire.local-shape.json","raw_sha256":"sha256:15a6ec3b326935cab7760d2960c7f7e496afa5411503d8393b5f864509046d1a"},{"path":"shapes/release-lineage-wire.local-shape.json","raw_sha256":"sha256:4d1672de5c91bf9470bcc5224bb9a427c9a083187188d6f01117dcef06c94b48"},{"path":"shapes/render-attempt-observation.local-shape.json","raw_sha256":"sha256:de1dbb1b216223ff62f037587ca229bd9e085dddd33f06c8c5b9785edbb49758"},{"path":"shapes/render-input-wire.local-shape.json","raw_sha256":"sha256:7a7b1ecdf3a4382f7189cfb0dc8a6fcf5b4dcaf558d511a301898fa86b036c90"},{"path":"shapes/rendered-asset-wire.local-shape.json","raw_sha256":"sha256:20183a10f1b01d30b4df3315d3be1092c482a4e3e92cc9ef602dd28c2b35336d"},{"path":"tests/test-stage-05-owner-source.json","raw_sha256":"sha256:dab847e00001a294f812a2781fb87c4b72886a6979cd24e2ce0d051af69826a3"}],"producer_manifest_path":"contributions/stage-05-owner-contribution.manifest.json"}